{
  "schema_version": "trading-strategy-archetype-registry.v1",
  "registry_id": "strategy_archetype_registry.trading.p036_p060",
  "generated_at": "2026-05-30T00:00:00.000Z",
  "phase_range": "P036-P060",
  "taxonomy_status": "complete",
  "safety_boundary": {
    "research_taxonomy_only": true,
    "financial_advice_generated": false,
    "trade_recommendation_generated": false,
    "order_intent_generated": false,
    "live_execution_allowed": false,
    "human_review_required": true
  },
  "phase_coverage": [
    { "phase_id": "P036", "title": "strategy_archetype_registry 생성", "status": "complete", "evidence_ref": "strategy_archetypes" },
    { "phase_id": "P037", "title": "Equity Long/Short archetype", "status": "complete", "evidence_ref": "equity_long_short" },
    { "phase_id": "P038", "title": "Equity Market Neutral archetype", "status": "complete", "evidence_ref": "equity_market_neutral" },
    { "phase_id": "P039", "title": "Statistical Arbitrage archetype", "status": "complete", "evidence_ref": "statistical_arbitrage" },
    { "phase_id": "P040", "title": "Short Bias archetype", "status": "complete", "evidence_ref": "short_bias" },
    { "phase_id": "P041", "title": "Relative Value archetype", "status": "complete", "evidence_ref": "relative_value" },
    { "phase_id": "P042", "title": "Pairs Trading archetype", "status": "complete", "evidence_ref": "pairs_trading" },
    { "phase_id": "P043", "title": "Convertible/Fixed Income Arb research_only placeholder", "status": "complete", "evidence_ref": "convertible_fixed_income_arbitrage" },
    { "phase_id": "P044", "title": "Event-Driven archetype", "status": "complete", "evidence_ref": "event_driven" },
    { "phase_id": "P045", "title": "Merger/earnings/corporate action event model", "status": "complete", "evidence_ref": "event_model.corporate_action" },
    { "phase_id": "P046", "title": "Crypto event model", "status": "complete", "evidence_ref": "event_model.crypto" },
    { "phase_id": "P047", "title": "Global Macro archetype", "status": "complete", "evidence_ref": "global_macro" },
    { "phase_id": "P048", "title": "Managed Futures/CTA trend-following archetype", "status": "complete", "evidence_ref": "managed_futures_cta" },
    { "phase_id": "P049", "title": "Volatility/Tail-risk archetype", "status": "complete", "evidence_ref": "volatility_tail_risk" },
    { "phase_id": "P050", "title": "Multi-Strategy allocator archetype", "status": "complete", "evidence_ref": "multi_strategy_allocator" },
    { "phase_id": "P051", "title": "Required data by archetype", "status": "complete", "evidence_ref": "strategy_archetypes.required_data" },
    { "phase_id": "P052", "title": "Tradability constraints by archetype", "status": "complete", "evidence_ref": "strategy_archetypes.tradability_constraints" },
    { "phase_id": "P053", "title": "Risk model by archetype", "status": "complete", "evidence_ref": "strategy_archetypes.risk_model" },
    { "phase_id": "P054", "title": "Signal output standardization", "status": "complete", "evidence_ref": "signal_output_standard" },
    { "phase_id": "P055", "title": "Strategy conflict model", "status": "complete", "evidence_ref": "strategy_conflict_model" },
    { "phase_id": "P056", "title": "Strategy correlation model", "status": "complete", "evidence_ref": "strategy_correlation_model" },
    { "phase_id": "P057", "title": "Strategy capacity/liquidity model", "status": "complete", "evidence_ref": "capacity_liquidity_model" },
    { "phase_id": "P058", "title": "Strategy lifecycle", "status": "complete", "evidence_ref": "lifecycle_model" },
    { "phase_id": "P059", "title": "Strategy archetype docs", "status": "complete", "evidence_ref": "docs/trading-pack-phase-ledger.md" },
    { "phase_id": "P060", "title": "trading:strategy-taxonomy", "status": "complete", "evidence_ref": "scripts/trading-strategy-taxonomy.mjs" }
  ],
  "strategy_archetypes": [
    {
      "archetype_id": "equity_long_short",
      "display_name": "Equity Long/Short",
      "phase_id": "P037",
      "category": "equity",
      "research_only": false,
      "tradability_status": "paper_allowed",
      "allowed_stages": ["research", "backtest", "paper"],
      "live_eligible": false,
      "short_capability_gate_required": true,
      "korea_short_selling_check_required": true,
      "required_data": ["ohlcv", "fundamental_snapshot", "borrow_availability_placeholder", "liquidity"],
      "tradability_constraints": ["paper_only", "short_capability_gate", "korea_short_selling_check", "no_leverage", "no_market_order"],
      "risk_model": { "risk_model_id": "risk.archetype.equity_long_short", "risk_factors": ["gross_exposure", "net_exposure", "single_name_concentration", "borrow_risk"], "default_risk_result": "block", "live_trade_allowed": false },
      "signal_output_standard": { "signal_contract": "trading-signal.v1", "allowed_signal_sides": ["buy", "sell", "hold", "reduce", "increase"], "order_intent_boundary": "signal_only_by_default", "human_review_required": true },
      "lifecycle_statuses": ["draft", "active", "disabled", "retired"],
      "capacity_liquidity_model": { "capacity_model_id": "capacity.equity_liquidity", "capacity_required": true, "liquidity_required": true }
    },
    {
      "archetype_id": "equity_market_neutral",
      "display_name": "Equity Market Neutral",
      "phase_id": "P038",
      "category": "equity",
      "research_only": false,
      "tradability_status": "paper_allowed",
      "allowed_stages": ["research", "backtest", "paper"],
      "live_eligible": false,
      "short_capability_gate_required": true,
      "korea_short_selling_check_required": true,
      "required_data": ["ohlcv", "factor_exposure", "sector_classification", "liquidity"],
      "tradability_constraints": ["paper_only", "market_neutrality_check", "short_capability_gate", "no_leverage", "no_market_order"],
      "risk_model": { "risk_model_id": "risk.archetype.equity_market_neutral", "risk_factors": ["factor_exposure", "sector_exposure", "beta_neutrality", "pair_breakdown"], "default_risk_result": "block", "live_trade_allowed": false },
      "signal_output_standard": { "signal_contract": "trading-signal.v1", "allowed_signal_sides": ["buy", "sell", "hold", "reduce", "increase"], "order_intent_boundary": "signal_only_by_default", "human_review_required": true },
      "lifecycle_statuses": ["draft", "active", "disabled", "retired"],
      "capacity_liquidity_model": { "capacity_model_id": "capacity.market_neutral", "capacity_required": true, "liquidity_required": true }
    },
    {
      "archetype_id": "statistical_arbitrage",
      "display_name": "Statistical Arbitrage",
      "phase_id": "P039",
      "category": "relative_value",
      "research_only": false,
      "tradability_status": "paper_allowed",
      "allowed_stages": ["research", "backtest", "paper"],
      "live_eligible": false,
      "short_capability_gate_required": true,
      "korea_short_selling_check_required": true,
      "required_data": ["ohlcv", "spread_history", "correlation_matrix", "borrow_availability_placeholder"],
      "tradability_constraints": ["paper_only", "short_capability_gate", "stale_data_block", "no_market_order"],
      "risk_model": { "risk_model_id": "risk.archetype.statistical_arbitrage", "risk_factors": ["model_decay", "correlation_break", "turnover", "liquidity"], "default_risk_result": "block", "live_trade_allowed": false },
      "signal_output_standard": { "signal_contract": "trading-signal.v1", "allowed_signal_sides": ["buy", "sell", "hold", "reduce"], "order_intent_boundary": "signal_only_by_default", "human_review_required": true },
      "lifecycle_statuses": ["draft", "active", "disabled", "retired"],
      "capacity_liquidity_model": { "capacity_model_id": "capacity.high_turnover", "capacity_required": true, "liquidity_required": true }
    },
    {
      "archetype_id": "short_bias",
      "display_name": "Short Bias",
      "phase_id": "P040",
      "category": "equity",
      "research_only": true,
      "tradability_status": "research_only",
      "allowed_stages": ["research"],
      "live_eligible": false,
      "short_capability_gate_required": true,
      "korea_short_selling_check_required": true,
      "required_data": ["borrow_availability_placeholder", "short_interest_placeholder", "ohlcv", "corporate_action"],
      "tradability_constraints": ["research_only", "short_capability_gate", "korea_short_selling_check", "no_live", "no_market_order"],
      "risk_model": { "risk_model_id": "risk.archetype.short_bias", "risk_factors": ["short_squeeze", "borrow_recall", "gap_risk", "regulatory_restriction"], "default_risk_result": "block", "live_trade_allowed": false },
      "signal_output_standard": { "signal_contract": "trading-signal.v1", "allowed_signal_sides": ["hold", "reduce"], "order_intent_boundary": "signal_only_by_default", "human_review_required": true },
      "lifecycle_statuses": ["draft", "active", "disabled", "retired"],
      "capacity_liquidity_model": { "capacity_model_id": "capacity.short_bias", "capacity_required": true, "liquidity_required": true }
    },
    {
      "archetype_id": "relative_value",
      "display_name": "Relative Value",
      "phase_id": "P041",
      "category": "relative_value",
      "research_only": false,
      "tradability_status": "paper_allowed",
      "allowed_stages": ["research", "backtest", "paper"],
      "live_eligible": false,
      "short_capability_gate_required": false,
      "korea_short_selling_check_required": false,
      "required_data": ["spread_history", "benchmark_curve_placeholder", "liquidity", "volatility"],
      "tradability_constraints": ["paper_only", "instrument_support_check", "no_derivatives_live", "no_leverage"],
      "risk_model": { "risk_model_id": "risk.archetype.relative_value", "risk_factors": ["basis_risk", "curve_shift", "funding_risk", "liquidity"], "default_risk_result": "block", "live_trade_allowed": false },